{
  "kind": "overlay_descriptor.v1",
  "version": "v1",
  "overlay_id": "context.session",
  "overlay_class": "contextual",
  "status": "seed",
  "runtime": {
    "manifest_ref": "contextual/session/manifest.v1.json",
    "materialized_bundle_ref": "contextual/session",
    "attachment_count": 1,
    "precedence_count": 0,
    "evidence_count": 1
  },
  "attachment_rules": [
    {
      "overlay": "context.session",
      "family": "*",
      "specialization": "*",
      "action": "*",
      "asset": "*",
      "risk": "*",
      "scope": "session"
    }
  ],
  "precedence_rules": [],
  "evidence_rules": [
    {
      "overlay": "context.session",
      "required": [
        "context_scope",
        "review_trace"
      ]
    }
  ],
  "composition": {
    "block_refs": []
  },
  "source": {
    "generator": "tools/gen/build_overlay_descriptors.py",
    "legacy_manifest_ref": "contextual/session/manifest.v1.json"
  }
}
